{"artifacts":[{"contentSha256":"fd3c0a65fa3faed4890ea18d1b887e99435f50d71783accfa58152deec6441be","kind":"plugin.bootstrap.php","ownerNodeId":"module/acme-observatory","path":"dist/acme-observatory/acme-observatory.php","sizeBytes":163,"sourceNodeIds":["hook/acme-observatory/init/register-visits","module/acme-observatory"],"sourceSpans":[{"end":{"column":51,"line":4,"offset":111},"path":"fixtures/semantic-plan/src/SemanticPlanFixture.hx","sourceSha256":"462105433b9a20dde949d7749c9897de0da223f86d6029d0b62fbc32ec71dd54","start":{"column":1,"line":4,"offset":61},"symbol":"fixtures.semanticplan.SemanticPlanFixture.moduleId"},{"end":{"column":48,"line":7,"offset":201},"path":"fixtures/semantic-plan/src/SemanticPlanFixture.hx","sourceSha256":"462105433b9a20dde949d7749c9897de0da223f86d6029d0b62fbc32ec71dd54","start":{"column":1,"line":7,"offset":154},"symbol":"fixtures.semanticplan.SemanticPlanFixture.registerVisits"}],"validators":["php.lint","php.syntax-floor","wordpress.static"]}],"canonicalization":"wordpress-hx.canonical-json.v1","coverage":{"emittedProjectionIds":["php/acme-observatory/bootstrap","php/acme-observatory/hooks/init/register-visits"],"requestedProjectionIds":["php/acme-observatory/bootstrap","php/acme-observatory/hooks/init/register-visits"]},"diagnostics":[],"emitter":{"emitterId":"wordpress.php","sourceSha256":"3a848b6bbe8278efdb2e220e5f879446c90cdad60090f472cf6a422cea53ab5d","version":"contract-fixture-v1"},"planDigest":"77292124c75633926f84475b14a02d84cb33f00145c60d3cef6e8f591cca1e74","resultDigest":"91aa7e154a906f3b903611c6c1e878331e5aa9d82f558d474ba6cdedcbca1fbe","resultDigestAlgorithm":"sha256-canonical-json-without-resultDigest-v1","schema":"wordpress-hx.semantic-emission.v1"}
